<?xml version="1.0"?>
<!DOCTYPE Report
[
<!ELEMENT Report (General ,(Doc|BPT)) >
<!ATTLIST Report ver CDATA #REQUIRED tmZone CDATA #REQUIRED>

<!ELEMENT General ( DocLocation ) >
<!ATTLIST General productName CDATA #REQUIRED productVer CDATA #REQUIRED os CDATA #REQUIRED host CDATA #REQUIRED qcserver CDATA #IMPLIED qcproject CDATA #IMPLIED SolManSolutionId CDATA #IMPLIED SolManProjectId CDATA #IMPLIED SolManTestPlanId CDATA #IMPLIED SolManTestPackageId CDATA #IMPLIED SolManUserInfoData CDATA #IMPLIED  >

<!ELEMENT BPT (DName,Res,DVer?,TSet?,TInst?,NodeArgs,AdditionalInfo*,Doc*) >
<!ATTLIST BPT rID ID #REQUIRED >

<!ELEMENT Doc (DName,ConfName?,Res,DVer?,TSet?,TInst?,RunType?,DT?,AdditionalInfo*,Step*,DIter*,Step*,Action*,Doc*,Summary?,TestMaintenanceSummary*,NodeArgs?) >
<!ATTLIST Doc rID ID #REQUIRED type (Test|BC|BPTWrapperTest|Flow|Group|Action) "Test" productName CDATA #REQUIRED BCIter CDATA #IMPLIED >

<!ELEMENT RunType ( #PCDATA )>
<!ATTLIST RunType fmStep (False|True) "False" batch (False|True) "False" upDesc (False|True) "False" upChk (False|True) "False" upAS (False|True) "False">

<!ELEMENT DName ( #PCDATA ) >

<!ELEMENT ConfName ( #PCDATA ) >

<!ELEMENT Res ( #PCDATA ) >

<!ELEMENT AdditionalInfo (AdditionalDataName,AdditionalDataValue ) >

<!ELEMENT AdditionalDataName ( #PCDATA ) >

<!ELEMENT AdditionalDataValue ( #PCDATA ) >

<!ELEMENT DVer ( #PCDATA ) >

<!ELEMENT TSet ( #PCDATA ) >

<!ELEMENT TInst ( #PCDATA ) >

<!ELEMENT DIter (Step*,Action+,Summary?,NodeArgs)>
<!ATTLIST DIter rID ID #REQUIRED iterID CDATA #REQUIRED>

<!ELEMENT DocLocation ( #PCDATA )>

<!ELEMENT Action (AName,AIter*,(Step|HtmlStep|Action)*, Summary,ActionMaintenanceSummary*, NodeArgs ) >
<!ATTLIST Action rID ID #REQUIRED>

<!ELEMENT AIter ((Step|HtmlStep|Action)*,DataMapping?, Summary?,NodeArgs) >
<!ATTLIST AIter rID ID #REQUIRED iterID CDATA #REQUIRED isCountable (False|True) "False" >

<!ELEMENT AName ( #PCDATA ) >

<!ELEMENT TestMaintenanceSummary (ActionMaintenanceSummary*) >
<!ATTLIST TestMaintenanceSummary ObjectsAdded CDATA #REQUIRED ObjectsUpdated CDATA #REQUIRED StepsUpdated CDATA #REQUIRED StepsComments CDATA #REQUIRED><!ELEMENT ActionMaintenanceSummary (ObjectChange* ) >
<!ATTLIST ActionMaintenanceSummary Action CDATA #REQUIRED Objects CDATA #REQUIRED Updated CDATA #REQUIRED LinesTotal CDATA #REQUIRED Added CDATA #REQUIRED LinesUpdated CDATA #REQUIRED>

<!ELEMENT ObjectChange  (Hierarchy, PropertyChangeList* ) >
<!ATTLIST ObjectChange Operation CDATA #IMPLIED OriginalRepository CDATA #IMPLIED>

<!ELEMENT PropertyChangeList (PropertyDef*) >

<!ELEMENT PropertyDef (OriginalValue, NewValue) >
<!ATTLIST PropertyDef PropName CDATA #REQUIRED OriginRegularExpression (True|False) "False" NewRegularExpression (True|False) "False" AddedProperty (True|False) "False" >

<!ELEMENT OriginalValue ( #PCDATA )>

<!ELEMENT NewValue ( #PCDATA )>

<!ELEMENT Hierarchy  (ObjectName, Hierarchy*) >
<!ATTLIST Hierarchy MicClass CDATA #REQUIRED>

<!ELEMENT ObjectName  ( #PCDATA ) >

<!ELEMENT Step (Obj,Details,Time,TimeTick* ,(Step|HtmlStep|Doc)*, DataMapping?, NodeArgs) >
<!ATTLIST Step rID ID #REQUIRED retval CDATA #IMPLIED>

<!ELEMENT HtmlStep (HTML,TimeTick*,(Step|HtmlStep|Doc)*,NodeArgs) >
<!ATTLIST HtmlStep rID ID #REQUIRED >

<!ELEMENT Obj ( #PCDATA ) >
<!ATTLIST Obj plainTxt (False|True) "True">

<!ELEMENT Details ( #PCDATA ) >
<!ATTLIST Details plainTxt (False|True) "True">

<!ELEMENT Time ( #PCDATA ) >

<!ELEMENT HTML ( #PCDATA ) >

<!ELEMENT Disp ( #PCDATA ) >

<!ELEMENT TimeTick ( #PCDATA ) >

<!ELEMENT DataMapping ( DataMappedItem* )>
<!ELEMENT DataMappedItem EMPTY >
<!ATTLIST DataMappedItem dsName CDATA #REQUIRED >
<!ATTLIST DataMappedItem rowId CDATA #REQUIRED >

<!ELEMENT NodeArgs (Disp,TopPane?,BtmPane?,ExtendedInfo? )>
<!ATTLIST NodeArgs eType CDATA #REQUIRED icon CDATA #REQUIRED nRep CDATA #REQUIRED UserNote CDATA #IMPLIED filter (False|True) "True">
<!ATTLIST NodeArgs status (Passed|Failed|Done|Warning|Information) "Done">
<!ATTLIST NodeArgs iconSel CDATA #IMPLIED nType CDATA #IMPLIED MovieMarker CDATA "">
<!ATTLIST NodeArgs Source CDATA #IMPLIED SourceLine CDATA #IMPLIED StepFlowItemKey CDATA #IMPLIED >

<!ELEMENT TopPane (Path)>

<!ELEMENT BtmPane ( (Path|WR)?,ASHilite?)>
<!ATTLIST BtmPane vType CDATA "HTML">

<!ELEMENT Path ( #PCDATA ) >

<!ELEMENT ASHilite ( #PCDATA ) >

<!ELEMENT WR ( #PCDATA ) >

<!ELEMENT ExtendedInfo ( StepData ) >

<!ATTLIST ExtendedInfo StepType CDATA #REQUIRED>
<!ELEMENT DT (NodeArgs) >
<!ATTLIST DT rID ID #REQUIRED>

<!ELEMENT Summary (Param*)>
<!ATTLIST Summary sTime CDATA #IMPLIED eTime CDATA #IMPLIED passed CDATA #IMPLIED failed CDATA #IMPLIED warnings CDATA #IMPLIED retval CDATA #IMPLIED stopped (False|True) "False" >

<!ELEMENT Param (ParamName,ParamVal)+ >
<!ATTLIST Param paramInOut (In|Out) "In">

<!ELEMENT ParamName ( #PCDATA ) >

<!ELEMENT ParamVal ( #PCDATA ) >

]
>
<Report ver="2.0" tmZone="India Standard Time">
<General productName="HPE Unified Functional Testing" productVer="14.03" os="" host="LAPTOP-7ORU2QJF"><DocLocation><![CDATA[C:\capgemini\KeywordDrivenFramework\Driver\Driver]]></DocLocation></General>
<Doc rID="T1"   productName= "HPE Unified Functional Testing"  >
<DName><![CDATA[Driver]]></DName>
<Res><![CDATA[Res27]]></Res>
<DT rID="T2">
<NodeArgs eType="Table" icon="2" nRep="4" filter="False" >
<Disp><![CDATA[Run-Time Data Table]]></Disp>
<BtmPane vType="Table" >
<Path><![CDATA[Default.xls]]></Path>
</BtmPane>
</NodeArgs>
</DT>
<DIter rID="T3" iterID="1" >
<Action rID="T4">
<AName><![CDATA[Action1]]></AName>
<Step rID="T5">
<Obj plainTxt="False" ><![CDATA[tr1]]></Obj>
<Details plainTxt="False" ><![CDATA[Transaction "tr1" started.]]></Details>
<Time><![CDATA[29-03-2022 - 15:15:23]]></Time>
<TimeTick>1648547123</TimeTick>
<NodeArgs eType="Transaction" icon="5" nRep="8" nType="Start Transaction" Source="Action1" SourceLine="10" >
<Disp><![CDATA[tr1]]></Disp>
</NodeArgs>
</Step>
<Step rID="T6">
<Obj plainTxt="False" ><![CDATA[SystemUtil]]></Obj>
<Details plainTxt="False" ><![CDATA[SystemUtil]]></Details>
<Time><![CDATA[29-03-2022 - 15:16:07]]></Time>
<TimeTick>1648547167</TimeTick>
<Step rID="T7">
<Obj plainTxt="False" ><![CDATA[Run "C:\Program Files (x86)\HPE\Unified Functional Testing\samples\Flights Application\FlightsGUI.exe",1]]></Obj>
<Details plainTxt="False" ><![CDATA[Run "C:\Program Files (x86)\HPE\Unified Functional Testing\samples\Flights Application\FlightsGUI.exe",1]]></Details>
<Time><![CDATA[29-03-2022 - 15:16:07]]></Time>
<TimeTick>1648547167</TimeTick>
<NodeArgs eType="Replay" icon="6" nRep="12" status="Passed" >
<Disp><![CDATA[Run "C:\Program Files (x86)\HPE\Unified Functional Testing\samples\Flights Application\FlightsGUI.exe",1]]></Disp>
</NodeArgs>
</Step>
<NodeArgs eType="Replay" icon="6" nRep="11" status="Passed" >
<Disp><![CDATA[SystemUtil]]></Disp>
</NodeArgs>
</Step>
<Step rID="T8">
<Obj plainTxt="False" ><![CDATA[HPE MyFlight Sample Applicatio]]></Obj>
<Details plainTxt="False" ><![CDATA[WpfWindow]]></Details>
<Time><![CDATA[29-03-2022 - 15:16:08]]></Time>
<TimeTick>1648547168</TimeTick>
<Step rID="T9">
<Obj plainTxt="False" ><![CDATA[agentName.Set]]></Obj>
<Details plainTxt="False" ><![CDATA["john"]]></Details>
<Time><![CDATA[29-03-2022 - 15:16:08]]></Time>
<TimeTick>1648547168</TimeTick>
<NodeArgs eType="Replay" icon="8" nRep="17" >
<Disp><![CDATA[agentName.Set]]></Disp>
</NodeArgs>
</Step>
<Step rID="T10">
<Obj plainTxt="False" ><![CDATA[password.Set]]></Obj>
<Details plainTxt="False" ><![CDATA["hp"]]></Details>
<Time><![CDATA[29-03-2022 - 15:16:09]]></Time>
<TimeTick>1648547169</TimeTick>
<NodeArgs eType="Replay" icon="8" nRep="19" >
<Disp><![CDATA[password.Set]]></Disp>
</NodeArgs>
</Step>
<Step rID="T11">
<Obj plainTxt="False" ><![CDATA[OK.WaitProperty]]></Obj>
<Details plainTxt="False" ><![CDATA["abs_x", 657, 10000]]></Details>
<Time><![CDATA[29-03-2022 - 15:16:19]]></Time>
<TimeTick>1648547179</TimeTick>
<NodeArgs eType="Replay" icon="9" nRep="21" status="Warning" >
<Disp><![CDATA[OK.WaitProperty]]></Disp>
</NodeArgs>
</Step>
<Step rID="T12">
<Obj plainTxt="False" ><![CDATA[OK.Click]]></Obj>
<Details plainTxt="False" ><![CDATA[]]></Details>
<Time><![CDATA[29-03-2022 - 15:16:19]]></Time>
<TimeTick>1648547179</TimeTick>
<NodeArgs eType="Replay" icon="9" nRep="23" >
<Disp><![CDATA[OK.Click]]></Disp>
</NodeArgs>
</Step>
<Step rID="T13">
<Obj plainTxt="False" ><![CDATA[HPE MyFlight Sample Applicatio.Exist]]></Obj>
<Details plainTxt="False" ><![CDATA["Object exists"]]></Details>
<Time><![CDATA[29-03-2022 - 15:16:19]]></Time>
<TimeTick>1648547179</TimeTick>
<NodeArgs eType="Replay" icon="7" nRep="24" >
<Disp><![CDATA[HPE MyFlight Sample Applicatio.Exist]]></Disp>
</NodeArgs>
</Step>
<NodeArgs eType="Context" icon="7" nRep="16" status="Warning" >
<Disp><![CDATA[HPE MyFlight Sample Applicatio]]></Disp>
</NodeArgs>
</Step>
<Step rID="T14">
<Obj ><![CDATA[Login]]></Obj>
<Details ><![CDATA[Login Successful]]></Details>
<Time><![CDATA[29-03-2022 - 15:16:20]]></Time>
<TimeTick>1648547180</TimeTick>
<NodeArgs eType="User" icon="10" nRep="25" status="Passed" >
<Disp><![CDATA[Login]]></Disp>
</NodeArgs>
</Step>
<Step rID="T15">
<Obj plainTxt="False" ><![CDATA[HPE MyFlight Sample Applicatio]]></Obj>
<Details plainTxt="False" ><![CDATA[WpfWindow]]></Details>
<Time><![CDATA[29-03-2022 - 15:16:27]]></Time>
<TimeTick>1648547187</TimeTick>
<Step rID="T16">
<Obj plainTxt="False" ><![CDATA[HPE MyFlight Sample Applicatio.Close]]></Obj>
<Details plainTxt="False" ><![CDATA[]]></Details>
<Time><![CDATA[29-03-2022 - 15:16:27]]></Time>
<TimeTick>1648547187</TimeTick>
<NodeArgs eType="Replay" icon="7" nRep="28" >
<Disp><![CDATA[HPE MyFlight Sample Applicatio.Close]]></Disp>
</NodeArgs>
</Step>
<Step rID="T17">
<Obj plainTxt="False" ><![CDATA[HPE MyFlight Sample Applicatio.Exist]]></Obj>
<Details plainTxt="False" ><![CDATA["Object does not exist"]]></Details>
<Time><![CDATA[29-03-2022 - 15:16:38]]></Time>
<TimeTick>1648547198</TimeTick>
<NodeArgs eType="Replay" icon="7" nRep="30" >
<Disp><![CDATA[HPE MyFlight Sample Applicatio.Exist]]></Disp>
</NodeArgs>
</Step>
<NodeArgs eType="Context" icon="7" nRep="27" >
<Disp><![CDATA[HPE MyFlight Sample Applicatio]]></Disp>
</NodeArgs>
</Step>
<Step rID="T18">
<Obj ><![CDATA[CloseApp]]></Obj>
<Details ><![CDATA[Closeapp unSuccessful]]></Details>
<Time><![CDATA[29-03-2022 - 15:16:38]]></Time>
<TimeTick>1648547198</TimeTick>
<NodeArgs eType="User" icon="10" nRep="31" status="Passed" >
<Disp><![CDATA[CloseApp]]></Disp>
</NodeArgs>
</Step>
<Step rID="T19">
<Obj plainTxt="False" ><![CDATA[SystemUtil]]></Obj>
<Details plainTxt="False" ><![CDATA[SystemUtil]]></Details>
<Time><![CDATA[29-03-2022 - 15:16:45]]></Time>
<TimeTick>1648547205</TimeTick>
<Step rID="T20">
<Obj plainTxt="False" ><![CDATA[Run "C:\Program Files (x86)\HPE\Unified Functional Testing\samples\Flights Application\FlightsGUI.exe",1]]></Obj>
<Details plainTxt="False" ><![CDATA[Run "C:\Program Files (x86)\HPE\Unified Functional Testing\samples\Flights Application\FlightsGUI.exe",1]]></Details>
<Time><![CDATA[29-03-2022 - 15:16:45]]></Time>
<TimeTick>1648547205</TimeTick>
<NodeArgs eType="Replay" icon="6" nRep="35" status="Passed" >
<Disp><![CDATA[Run "C:\Program Files (x86)\HPE\Unified Functional Testing\samples\Flights Application\FlightsGUI.exe",1]]></Disp>
</NodeArgs>
</Step>
<NodeArgs eType="Replay" icon="6" nRep="34" status="Passed" >
<Disp><![CDATA[SystemUtil]]></Disp>
</NodeArgs>
</Step>
<Step rID="T21">
<Obj plainTxt="False" ><![CDATA[HPE MyFlight Sample Applicatio]]></Obj>
<Details plainTxt="False" ><![CDATA[WpfWindow]]></Details>
<Time><![CDATA[29-03-2022 - 15:16:46]]></Time>
<TimeTick>1648547206</TimeTick>
<Step rID="T22">
<Obj plainTxt="False" ><![CDATA[agentName.Set]]></Obj>
<Details plainTxt="False" ><![CDATA["john"]]></Details>
<Time><![CDATA[29-03-2022 - 15:16:46]]></Time>
<TimeTick>1648547206</TimeTick>
<NodeArgs eType="Replay" icon="8" nRep="41" >
<Disp><![CDATA[agentName.Set]]></Disp>
</NodeArgs>
</Step>
<Step rID="T23">
<Obj plainTxt="False" ><![CDATA[password.Set]]></Obj>
<Details plainTxt="False" ><![CDATA["hp"]]></Details>
<Time><![CDATA[29-03-2022 - 15:16:46]]></Time>
<TimeTick>1648547206</TimeTick>
<NodeArgs eType="Replay" icon="8" nRep="43" >
<Disp><![CDATA[password.Set]]></Disp>
</NodeArgs>
</Step>
<Step rID="T24">
<Obj plainTxt="False" ><![CDATA[OK.WaitProperty]]></Obj>
<Details plainTxt="False" ><![CDATA["abs_x", 657, 10000]]></Details>
<Time><![CDATA[29-03-2022 - 15:16:56]]></Time>
<TimeTick>1648547216</TimeTick>
<NodeArgs eType="Replay" icon="9" nRep="45" status="Warning" >
<Disp><![CDATA[OK.WaitProperty]]></Disp>
</NodeArgs>
</Step>
<Step rID="T25">
<Obj plainTxt="False" ><![CDATA[OK.Click]]></Obj>
<Details plainTxt="False" ><![CDATA[]]></Details>
<Time><![CDATA[29-03-2022 - 15:16:56]]></Time>
<TimeTick>1648547216</TimeTick>
<NodeArgs eType="Replay" icon="9" nRep="47" >
<Disp><![CDATA[OK.Click]]></Disp>
</NodeArgs>
</Step>
<Step rID="T26">
<Obj plainTxt="False" ><![CDATA[HPE MyFlight Sample Applicatio.Exist]]></Obj>
<Details plainTxt="False" ><![CDATA["Object exists"]]></Details>
<Time><![CDATA[29-03-2022 - 15:16:57]]></Time>
<TimeTick>1648547217</TimeTick>
<NodeArgs eType="Replay" icon="7" nRep="48" >
<Disp><![CDATA[HPE MyFlight Sample Applicatio.Exist]]></Disp>
</NodeArgs>
</Step>
<NodeArgs eType="Context" icon="7" nRep="40" status="Warning" >
<Disp><![CDATA[HPE MyFlight Sample Applicatio]]></Disp>
</NodeArgs>
</Step>
<Step rID="T27">
<Obj ><![CDATA[Login]]></Obj>
<Details ><![CDATA[Login Successful]]></Details>
<Time><![CDATA[29-03-2022 - 15:16:57]]></Time>
<TimeTick>1648547217</TimeTick>
<NodeArgs eType="User" icon="10" nRep="49" status="Passed" >
<Disp><![CDATA[Login]]></Disp>
</NodeArgs>
</Step>
<Step rID="T28">
<Obj plainTxt="False" ><![CDATA[HPE MyFlight Sample Applicatio]]></Obj>
<Details plainTxt="False" ><![CDATA[WpfWindow]]></Details>
<Time><![CDATA[29-03-2022 - 15:17:00]]></Time>
<TimeTick>1648547220</TimeTick>
<Step rID="T29">
<Obj plainTxt="False" ><![CDATA[WpfTabStrip.Select]]></Obj>
<Details plainTxt="False" ><![CDATA["SEARCH ORDER"]]></Details>
<Time><![CDATA[29-03-2022 - 15:17:00]]></Time>
<TimeTick>1648547220</TimeTick>
<NodeArgs eType="Replay" icon="11" nRep="52" >
<Disp><![CDATA[WpfTabStrip.Select]]></Disp>
</NodeArgs>
</Step>
<Step rID="T30">
<Obj plainTxt="False" ><![CDATA[byNumberRadio.Set]]></Obj>
<Details plainTxt="False" ><![CDATA[]]></Details>
<Time><![CDATA[29-03-2022 - 15:17:00]]></Time>
<TimeTick>1648547220</TimeTick>
<NodeArgs eType="Replay" icon="12" nRep="54" >
<Disp><![CDATA[byNumberRadio.Set]]></Disp>
</NodeArgs>
</Step>
<Step rID="T31">
<Obj plainTxt="False" ><![CDATA[byNumberWatermark.Set]]></Obj>
<Details plainTxt="False" ><![CDATA["3"]]></Details>
<Time><![CDATA[29-03-2022 - 15:17:00]]></Time>
<TimeTick>1648547220</TimeTick>
<NodeArgs eType="Replay" icon="8" nRep="56" >
<Disp><![CDATA[byNumberWatermark.Set]]></Disp>
</NodeArgs>
</Step>
<Step rID="T32">
<Obj plainTxt="False" ><![CDATA[SEARCH.Click]]></Obj>
<Details plainTxt="False" ><![CDATA[]]></Details>
<Time><![CDATA[29-03-2022 - 15:17:00]]></Time>
<TimeTick>1648547220</TimeTick>
<NodeArgs eType="Replay" icon="9" nRep="58" >
<Disp><![CDATA[SEARCH.Click]]></Disp>
</NodeArgs>
</Step>
<Step rID="T33">
<Obj plainTxt="False" ><![CDATA[HPE MyFlight Sample Applicatio.Close]]></Obj>
<Details plainTxt="False" ><![CDATA[]]></Details>
<Time><![CDATA[29-03-2022 - 15:17:03]]></Time>
<TimeTick>1648547223</TimeTick>
<NodeArgs eType="Replay" icon="7" nRep="60" >
<Disp><![CDATA[HPE MyFlight Sample Applicatio.Close]]></Disp>
</NodeArgs>
</Step>
<Step rID="T34">
<Obj plainTxt="False" ><![CDATA[HPE MyFlight Sample Applicatio.Exist]]></Obj>
<Details plainTxt="False" ><![CDATA["Object does not exist"]]></Details>
<Time><![CDATA[29-03-2022 - 15:17:14]]></Time>
<TimeTick>1648547234</TimeTick>
<NodeArgs eType="Replay" icon="7" nRep="62" >
<Disp><![CDATA[HPE MyFlight Sample Applicatio.Exist]]></Disp>
</NodeArgs>
</Step>
<NodeArgs eType="Context" icon="7" nRep="51" >
<Disp><![CDATA[HPE MyFlight Sample Applicatio]]></Disp>
</NodeArgs>
</Step>
<Step rID="T35">
<Obj ><![CDATA[CloseApp]]></Obj>
<Details ><![CDATA[Closeapp unSuccessful]]></Details>
<Time><![CDATA[29-03-2022 - 15:17:14]]></Time>
<TimeTick>1648547234</TimeTick>
<NodeArgs eType="User" icon="10" nRep="63" status="Passed" >
<Disp><![CDATA[CloseApp]]></Disp>
</NodeArgs>
</Step>
<Step rID="T36">
<Obj plainTxt="False" ><![CDATA[SystemUtil]]></Obj>
<Details plainTxt="False" ><![CDATA[SystemUtil]]></Details>
<Time><![CDATA[29-03-2022 - 15:17:22]]></Time>
<TimeTick>1648547242</TimeTick>
<Step rID="T37">
<Obj plainTxt="False" ><![CDATA[Run "C:\Program Files (x86)\HPE\Unified Functional Testing\samples\Flights Application\FlightsGUI.exe",1]]></Obj>
<Details plainTxt="False" ><![CDATA[Run "C:\Program Files (x86)\HPE\Unified Functional Testing\samples\Flights Application\FlightsGUI.exe",1]]></Details>
<Time><![CDATA[29-03-2022 - 15:17:22]]></Time>
<TimeTick>1648547242</TimeTick>
<NodeArgs eType="Replay" icon="6" nRep="67" status="Passed" >
<Disp><![CDATA[Run "C:\Program Files (x86)\HPE\Unified Functional Testing\samples\Flights Application\FlightsGUI.exe",1]]></Disp>
</NodeArgs>
</Step>
<NodeArgs eType="Replay" icon="6" nRep="66" status="Passed" >
<Disp><![CDATA[SystemUtil]]></Disp>
</NodeArgs>
</Step>
<Step rID="T38">
<Obj plainTxt="False" ><![CDATA[HPE MyFlight Sample Applicatio]]></Obj>
<Details plainTxt="False" ><![CDATA[WpfWindow]]></Details>
<Time><![CDATA[29-03-2022 - 15:17:23]]></Time>
<TimeTick>1648547243</TimeTick>
<Step rID="T39">
<Obj plainTxt="False" ><![CDATA[agentName.Set]]></Obj>
<Details plainTxt="False" ><![CDATA["john"]]></Details>
<Time><![CDATA[29-03-2022 - 15:17:23]]></Time>
<TimeTick>1648547243</TimeTick>
<NodeArgs eType="Replay" icon="8" nRep="72" >
<Disp><![CDATA[agentName.Set]]></Disp>
</NodeArgs>
</Step>
<Step rID="T40">
<Obj plainTxt="False" ><![CDATA[password.Set]]></Obj>
<Details plainTxt="False" ><![CDATA["hp"]]></Details>
<Time><![CDATA[29-03-2022 - 15:17:23]]></Time>
<TimeTick>1648547243</TimeTick>
<NodeArgs eType="Replay" icon="8" nRep="74" >
<Disp><![CDATA[password.Set]]></Disp>
</NodeArgs>
</Step>
<Step rID="T41">
<Obj plainTxt="False" ><![CDATA[OK.WaitProperty]]></Obj>
<Details plainTxt="False" ><![CDATA["abs_x", 657, 10000]]></Details>
<Time><![CDATA[29-03-2022 - 15:17:33]]></Time>
<TimeTick>1648547253</TimeTick>
<NodeArgs eType="Replay" icon="9" nRep="76" status="Warning" >
<Disp><![CDATA[OK.WaitProperty]]></Disp>
</NodeArgs>
</Step>
<Step rID="T42">
<Obj plainTxt="False" ><![CDATA[OK.Click]]></Obj>
<Details plainTxt="False" ><![CDATA[]]></Details>
<Time><![CDATA[29-03-2022 - 15:17:33]]></Time>
<TimeTick>1648547253</TimeTick>
<NodeArgs eType="Replay" icon="9" nRep="78" >
<Disp><![CDATA[OK.Click]]></Disp>
</NodeArgs>
</Step>
<Step rID="T43">
<Obj plainTxt="False" ><![CDATA[HPE MyFlight Sample Applicatio.Exist]]></Obj>
<Details plainTxt="False" ><![CDATA["Object exists"]]></Details>
<Time><![CDATA[29-03-2022 - 15:17:33]]></Time>
<TimeTick>1648547253</TimeTick>
<NodeArgs eType="Replay" icon="7" nRep="79" >
<Disp><![CDATA[HPE MyFlight Sample Applicatio.Exist]]></Disp>
</NodeArgs>
</Step>
<NodeArgs eType="Context" icon="7" nRep="71" status="Warning" >
<Disp><![CDATA[HPE MyFlight Sample Applicatio]]></Disp>
</NodeArgs>
</Step>
<Step rID="T44">
<Obj ><![CDATA[Login]]></Obj>
<Details ><![CDATA[Login Successful]]></Details>
<Time><![CDATA[29-03-2022 - 15:17:33]]></Time>
<TimeTick>1648547253</TimeTick>
<NodeArgs eType="User" icon="10" nRep="80" status="Passed" >
<Disp><![CDATA[Login]]></Disp>
</NodeArgs>
</Step>
<Step rID="T45">
<Obj plainTxt="False" ><![CDATA[HPE MyFlight Sample Applicatio]]></Obj>
<Details plainTxt="False" ><![CDATA[WpfWindow]]></Details>
<Time><![CDATA[29-03-2022 - 15:17:40]]></Time>
<TimeTick>1648547260</TimeTick>
<Step rID="T46">
<Obj plainTxt="False" ><![CDATA[WpfTabStrip.Select]]></Obj>
<Details plainTxt="False" ><![CDATA["SEARCH ORDER"]]></Details>
<Time><![CDATA[29-03-2022 - 15:17:40]]></Time>
<TimeTick>1648547260</TimeTick>
<NodeArgs eType="Replay" icon="11" nRep="83" >
<Disp><![CDATA[WpfTabStrip.Select]]></Disp>
</NodeArgs>
</Step>
<Step rID="T47">
<Obj plainTxt="False" ><![CDATA[byNumberRadio.Set]]></Obj>
<Details plainTxt="False" ><![CDATA[]]></Details>
<Time><![CDATA[29-03-2022 - 15:17:40]]></Time>
<TimeTick>1648547260</TimeTick>
<NodeArgs eType="Replay" icon="12" nRep="85" >
<Disp><![CDATA[byNumberRadio.Set]]></Disp>
</NodeArgs>
</Step>
<Step rID="T48">
<Obj plainTxt="False" ><![CDATA[byNumberWatermark.Set]]></Obj>
<Details plainTxt="False" ><![CDATA["3"]]></Details>
<Time><![CDATA[29-03-2022 - 15:17:40]]></Time>
<TimeTick>1648547260</TimeTick>
<NodeArgs eType="Replay" icon="8" nRep="87" >
<Disp><![CDATA[byNumberWatermark.Set]]></Disp>
</NodeArgs>
</Step>
<Step rID="T49">
<Obj plainTxt="False" ><![CDATA[SEARCH.Click]]></Obj>
<Details plainTxt="False" ><![CDATA[]]></Details>
<Time><![CDATA[29-03-2022 - 15:17:41]]></Time>
<TimeTick>1648547261</TimeTick>
<NodeArgs eType="Replay" icon="9" nRep="89" >
<Disp><![CDATA[SEARCH.Click]]></Disp>
</NodeArgs>
</Step>
<Step rID="T50">
<Obj plainTxt="False" ><![CDATA[numOfTicketsCombo.Select]]></Obj>
<Details plainTxt="False" ><![CDATA["6"]]></Details>
<Time><![CDATA[29-03-2022 - 15:17:44]]></Time>
<TimeTick>1648547264</TimeTick>
<NodeArgs eType="Replay" icon="13" nRep="91" >
<Disp><![CDATA[numOfTicketsCombo.Select]]></Disp>
</NodeArgs>
</Step>
<Step rID="T51">
<Obj plainTxt="False" ><![CDATA[updateBtn.Click]]></Obj>
<Details plainTxt="False" ><![CDATA[]]></Details>
<Time><![CDATA[29-03-2022 - 15:17:44]]></Time>
<TimeTick>1648547264</TimeTick>
<NodeArgs eType="Replay" icon="9" nRep="93" >
<Disp><![CDATA[updateBtn.Click]]></Disp>
</NodeArgs>
</Step>
<Step rID="T52">
<Obj plainTxt="False" ><![CDATA[HPE MyFlight Sample Applicatio.Close]]></Obj>
<Details plainTxt="False" ><![CDATA[]]></Details>
<Time><![CDATA[29-03-2022 - 15:17:47]]></Time>
<TimeTick>1648547267</TimeTick>
<NodeArgs eType="Replay" icon="7" nRep="95" >
<Disp><![CDATA[HPE MyFlight Sample Applicatio.Close]]></Disp>
</NodeArgs>
</Step>
<Step rID="T53">
<Obj plainTxt="False" ><![CDATA[HPE MyFlight Sample Applicatio.Exist]]></Obj>
<Details plainTxt="False" ><![CDATA["Object does not exist"]]></Details>
<Time><![CDATA[29-03-2022 - 15:17:57]]></Time>
<TimeTick>1648547277</TimeTick>
<NodeArgs eType="Replay" icon="7" nRep="97" >
<Disp><![CDATA[HPE MyFlight Sample Applicatio.Exist]]></Disp>
</NodeArgs>
</Step>
<NodeArgs eType="Context" icon="7" nRep="82" >
<Disp><![CDATA[HPE MyFlight Sample Applicatio]]></Disp>
</NodeArgs>
</Step>
<Step rID="T54">
<Obj ><![CDATA[CloseApp]]></Obj>
<Details ><![CDATA[Closeapp unSuccessful]]></Details>
<Time><![CDATA[29-03-2022 - 15:17:57]]></Time>
<TimeTick>1648547277</TimeTick>
<NodeArgs eType="User" icon="10" nRep="98" status="Passed" >
<Disp><![CDATA[CloseApp]]></Disp>
</NodeArgs>
</Step>
<Step rID="T55">
<Obj plainTxt="False" ><![CDATA[tr1]]></Obj>
<Details plainTxt="False" ><![CDATA[Transaction "tr1" ended with "Pass" status (Total Duration: 155.4099 sec).]]></Details>
<Time><![CDATA[29-03-2022 - 15:17:58]]></Time>
<TimeTick>1648547278</TimeTick>
<NodeArgs eType="Transaction" icon="14" nRep="99" nType="End Transaction" Source="Action1" SourceLine="90" >
<Disp><![CDATA[tr1]]></Disp>
</NodeArgs>
</Step>
<Summary sTime="29-03-2022 - 15:15:23" eTime="29-03-2022 - 15:17:58" passed="9" failed="0" warnings="3" ></Summary>
<NodeArgs eType="StartAction" icon="4" nRep="7" status="Warning" >
<Disp><![CDATA[Action1 Summary]]></Disp>
</NodeArgs>
</Action>
<Action rID="T56">
<AName><![CDATA[Action2]]></AName>
<Summary sTime="29-03-2022 - 15:17:58" eTime="29-03-2022 - 15:17:58" passed="0" failed="0" warnings="0" ></Summary>
<NodeArgs eType="StartAction" icon="4" nRep="101" >
<Disp><![CDATA[Action2 Summary]]></Disp>
</NodeArgs>
</Action>
<Action rID="T57">
<AName><![CDATA[Action3]]></AName>
<Summary sTime="29-03-2022 - 15:17:59" eTime="29-03-2022 - 15:17:59" passed="0" failed="0" warnings="0" ></Summary>
<NodeArgs eType="StartAction" icon="4" nRep="103" >
<Disp><![CDATA[Action3 Summary]]></Disp>
</NodeArgs>
</Action>
<NodeArgs eType="StartIteration" icon="3" nRep="6" status="Warning" >
<Disp><![CDATA[Driver Iteration 1 (Row 1)]]></Disp>
</NodeArgs>
</DIter>
<Summary sTime="29-03-2022 - 15:15:21" eTime="29-03-2022 - 15:17:59" passed="9" failed="0" warnings="3" ></Summary>
<NodeArgs eType="StartTest" icon="1" nRep="3" status="Warning" >
<Disp><![CDATA[Test Driver Summary]]></Disp>
</NodeArgs>
</Doc>
</Report>